IS.DTQN;Cerro El Cuaulotal;Ratione quis corrupti tenetur nisi at et.;Paul Ankunding;4;unbekannt;;922000;TECH.LYON,TECH.EWJG,TECH.BPYS,TECH.XQPE;03.07.2017;ORG.LIEK
IS.ZWEW;Budimirski Vis;Porro enim quis est molestiae omnis deleniti placeat molestiae non.;Miss Tommie Conroy;2;XL (1000);;3609000;TECH.YMVO;08.05.1998;ORG.QIEC
IS.YGYZ;Flat Top;Aperiam dolor unde qui accusamus enim beatae sapiente.;Antoine Johnson;5;S (50);;4373000;TECH.UBQW,TECH.BESN,TECH.EWJG;05.11.2005;"ORG.LIEK;ORG.ECGN"
IS.TYKU;Mont Bouinguinlin;Velit sunt repellat suscipit deleniti doloremque iure quo.;Ali Friesen;5;XL (1000);;4724000;TECH.IYIN,TECH.QMYL,TECH.JVQP;28.01.1994;"ORG.XTOD;ORG.QIEC"
IS.XJBB;Skaines Mountain;Dolores reprehenderit aut consectetur quod amet minus commodi qui sit.;Dr. Lucien Hoppe;6;XL (1000);;1673000;TECH.NFNK,TECH.HSOA,TECH.IENJ,TECH.BESN;21.05.2015;ORG.LIEK
IS.XCLT;Grønnlifjellet;Autem nesciunt distinctio eius dolor blanditiis quaerat laudantium est.;Leonel Borer;10;XXS (1);;3641000;TECH.ANEZ,TECH.BPYS,TECH.IYIN,TECH.KHLR,TECH.PIVU;10.05.1996;"ORG.LIEK;ORG.QIEC"
IS.QVVT;Bukit Rasau;Quos velit consequuntur id debitis hic molestiae ab pariatur.;Francisca Murazik;1;XS (10);;1383000;TECH.TPYY,TECH.CSKO,TECH.YXCU;06.03.2010;ORG.QIEC
IS.QHRZ;Cerro El Vigia;Magnam consequatur eveniet aut vitae sapiente et sed.;Lucius Borer;3;M (100);;2969000;TECH.WAER;17.11.2017;"ORG.XTOD;ORG.ECGN"
IS.DJMG;Doi Lo;Labore quas et maxime et provident distinctio blanditiis.;Ms. Sara Witting;2;L (500);;525000;TECH.TPYY,TECH.QCQR,TECH.MQBD;23.11.2011;"ORG.LIEK;ORG.URMM"
IS.IVNK;Sæternakken;Voluptates ipsam et enim iste ea expedita quo sapiente nisi.;Genie Bins Jr.;2;L (500);;3215000;TECH.WAER,TECH.EFDG,TECH.YXCU;20.08.1999;ORG.QIEC
IS.PMOW;Sinoen;Molestiae et non rerum rerum quia rerum.;Miss Bernardo Steuber;4;unbekannt;;2508000;TECH.TUVN,TECH.MQBD,TECH.YXCU,TECH.JVQP,TECH.XQPE;18.09.2001;"ORG.XTOD;ORG.QIEC"
IS.HYVQ;Band-e Sinjid;Et omnis vel pariatur animi dolores possimus vel pariatur.;Alden Leuschke;8;XS (10);;2065000;TECH.ANEZ;14.07.2005;ORG.URMM
IS.KCRF;Kálo Óros;Qui nihil vero omnis et illo eius.;Barrett Schumm;2;XXL (10000);;1026000;TECH.HSOA;17.12.2006;ORG.ECGN
IS.XBQY;K?h-e Zard Now;Vero incidunt maxime quia sed nihil non corporis.;Farah Harber Sr.;3;M (100);;172000;TECH.BPYS,TECH.KHLR;01.08.2014;ORG.XTOD
IS.ZFSZ;Hohentwiel;Doloremque est qui tempora voluptatem et accusamus vel molestiae provident.;Lucius Schultz MD;6;S (50);;1063000;TECH.TPYY,TECH.UBQW,TECH.BESN,TECH.IBJC,TECH.QMYL;14.05.2007;ORG.XTOD
IS.DNDS;Baske;Consequatur ut velit voluptas quos et quis earum.;Mr. Kathleen Raynor;6;XXS (1);;3013000;TECH.JOKT,TECH.CSKO,TECH.UBQW,TECH.MQBD;15.12.2000;ORG.QIEC
IS.AYCD;K?h-e Var?zem Ch?l;Maiores est distinctio magnam itaque nam voluptate suscipit.;Peg Kuhlman MD;1;XXS (1);;1168000;TECH.TPYY,TECH.JOKT,TECH.UBQW,TECH.CSKO,TECH.BPYS;12.04.2008;ORG.LIEK
IS.IQCT;Cerro Rurorgo;Et molestias rem enim totam distinctio ratione error.;Duncan Funk;5;S (50);;1500000;TECH.ADYU;28.10.2002;"ORG.LIEK;ORG.URMM"
IS.JHFI;Spread Bend Mountain;Omnis et tempora ut sint porro cum.;Teodoro Strosin;7;XL (1000);;1318000;TECH.ANEZ,TECH.BESN;14.09.1993;ORG.LIEK
IS.BIXO;Cerro Ricoa Vieja;Nobis natus qui excepturi aliquid vel saepe aut consequatur voluptatem.;Garnet O'Kon;2;L (500);;1165000;TECH.TPYY,TECH.QCQR,TECH.IENJ;25.09.2003;"ORG.LIEK;ORG.ECGN"
IS.GHOJ;Gaadet el Ghozlane;Unde nulla repudiandae nulla itaque mollitia voluptatem corrupti consequatur eos.;Pat Pfeffer;4;unbekannt;;3328000;TECH.JOKT,TECH.UBQW,TECH.YMVO,TECH.PIVU;03.04.1996;ORG.QIEC
IS.HRPH;Mont Vairu;Sunt autem similique aut ullam earum dolores earum.;Sal Kihn;3;L (500);;4173000;TECH.HSOA,TECH.WAER,TECH.ADYU,TECH.YXCU,TECH.YLSE;26.05.2015;ORG.QIEC
IS.XIWN;Bersu Terara;Voluptate odio deleniti reprehenderit velit voluptatem occaecati veritatis libero consequatur.;Jerrod Marks;10;S (50);;2493000;TECH.IENJ,TECH.EWJG,TECH.YXCU,TECH.PIVU,TECH.JVQP;22.07.1996;ORG.URMM
IS.WNKR;Jabal Kamdnkowab;Quis aut cupiditate corrupti cum quis ea eius.;Shoshana Runolfsson;5;S (50);;2493000;TECH.SHJB,TECH.BPYS;28.06.1994;ORG.LIEK
IS.MFIU;Cerro Los Cueramos;Eos magni ea corrupti unde cumque eius odio.;Loura Cormier;7;XL (1000);;2360000;TECH.LYON,TECH.YXCU;17.12.2006;"ORG.XTOD;ORG.URMM"
IS.ZRZV;Cerro San Antonio;Odit non enim vitae aut sit exercitationem qui et.;Robbie Feeney;8;XS (10);;4450000;TECH.QCQR,TECH.BESN,TECH.IYIN,TECH.PIVU,TECH.KHLR;14.01.2013;ORG.LIEK
IS.GBBT;Lizzie Mountain;Itaque accusamus sint aut unde et dolore ab inventore.;Caterina McGlynn;5;L (500);;3889000;TECH.IBJC;20.09.1991;ORG.URMM
IS.DHGS;Butternut Hill;Voluptatum qui qui voluptate labore voluptatem laborum doloremque inventore numquam.;Ellis Hoppe;7;XL (1000);;618000;TECH.CSKO,TECH.IENJ,TECH.JVQP;06.10.2004;"ORG.LIEK;ORG.QIEC"
IS.ZRRS;Cerro Koari;Quidem consectetur veniam sint et rerum eligendi.;Hollis Grimes;4;XS (10);;2253000;TECH.LYON,TECH.BPYS;26.07.1991;ORG.LIEK
IS.CTJM;Mount Desmond;Culpa deleniti distinctio tempore qui cum est et.;Mrs. Austin Johns;2;S (50);;1279000;TECH.JOKT;22.04.2014;ORG.URMM
IS.LVTD;K?h-e K?chak Kor D?gh?;Qui nostrum nihil minima tempora aspernatur quo et voluptas itaque.;Rene Ernser;3;unbekannt;;1603000;TECH.UBQW,TECH.BESN;18.06.1993;"ORG.LIEK;ORG.URMM"
IS.WIQL;Terrible Mountain;Fuga quos nam incidunt non accusantium modi.;Kayce Zemlak;10;L (500);;1038000;TECH.NFNK,TECH.SHJB,TECH.BPYS,TECH.KHLR;21.11.2008;ORG.LIEK
IS.BSCK;Jabal K?r?kh;Incidunt repudiandae repellendus placeat consectetur porro expedita omnis ut.;Moshe Hane;3;XL (1000);;967000;TECH.DXUV,TECH.QCQR,TECH.UBQW;18.10.2016;ORG.LIEK
IS.CCIC;K?h-e S?l D?gh?;Qui explicabo ut aut eos placeat sit et quia repellendus.;Nancee Morar I;4;XXS (1);;2477000;TECH.DXUV,TECH.YXCU;21.10.2008;ORG.URMM
IS.AHPE;K?h-e Gat ?eydar;Quis saepe accusantium quas necessitatibus alias cupiditate labore.;Miss Ricky Luettgen;6;S (50);;1861000;TECH.BPYS;23.09.2017;ORG.LIEK
IS.HYDT;Mpunzi Kop;Sint recusandae officia doloribus quae autem sed ipsam.;Ms. Geoffrey Herzog;7;XL (1000);;4020000;TECH.QMYL;11.04.2008;ORG.XTOD
IS.IEBM;Ghar Tlet Idardar;Consequatur voluptatem sunt distinctio amet adipisci et voluptatibus.;Dino Ernser II;4;XL (1000);;1376000;TECH.SHJB,TECH.YMVO,TECH.QMYL,TECH.PIVU;25.10.2007;"ORG.LIEK;ORG.QIEC"
IS.QVLQ;Soldier Mountain;Rem est libero architecto fuga reprehenderit autem tempora.;Divina Windler III;9;S (50);;4039000;TECH.EWJG;27.11.2011;ORG.LIEK
IS.EVHA;Pinken;Libero asperiores exercitationem non asperiores ut alias sunt.;Julian Pollich DVM;5;unbekannt;;228000;TECH.ANEZ;06.04.2014;"ORG.XTOD;ORG.URMM"
IS.DIHO;Gunung Sinongan;Accusamus asperiores vel aut quod reiciendis quibusdam rem sit.;Claudette Bauch III;3;XS (10);;2817000;TECH.PIVU;28.07.1992;"ORG.XTOD;ORG.URMM"
IS.WOLI;Iguer Oujna;Aperiam dicta non aliquid minus qui quas qui error quis.;Tangela Streich;2;unbekannt;;620000;TECH.TPYY,TECH.YMVO,TECH.TUVN,TECH.JVQP;05.04.2016;ORG.URMM
IS.SCPY;Cerro El Pri;Eos nemo quaerat ad incidunt tempore delectus non.;Randy Beer;10;unbekannt;;4921000;TECH.CSKO,TECH.IBJC,TECH.BPYS,TECH.YXCU;08.07.1995;ORG.LIEK
IS.MUUN;Gora Chodoridag;Perspiciatis doloribus totam soluta suscipit cumque fuga perspiciatis.;Elisha Hayes;7;M (100);;1394000;TECH.UBQW,TECH.YXCU;28.08.1996;ORG.URMM
IS.MYUJ;Cerro Antaccacca;Eos dolorem quia quis eveniet consequatur similique eos.;Taylor Morar IV;3;XXL (10000);;4678000;TECH.SHJB,TECH.IYIN;05.02.2005;ORG.XTOD
IS.HWPG;Gunung Gedogan;Libero aperiam ut vero expedita id ad nostrum possimus earum.;Darryl Langworth;3;S (50);;2589000;TECH.HSOA,TECH.YLSE;14.04.1999;ORG.URMM
IS.BFHI;Phou Longpôt;Et ab distinctio consequatur debitis neque reprehenderit.;Calvin Schaden;4;S (50);;1210000;TECH.ANEZ,TECH.CSKO,TECH.YMVO;15.11.2011;ORG.ECGN
IS.NTPR;K?h-e Koleh B?d;Asperiores perferendis modi officiis placeat quia iure cumque itaque.;Bettye Shields;10;XXL (10000);;1470000;TECH.DXUV,TECH.QCQR,TECH.EWJG,TECH.KHLR;10.11.1990;"ORG.XTOD;ORG.LIEK"
IS.FARE;Kringlåthøa;Fuga occaecati voluptas doloribus soluta itaque ut mollitia.;Miyoko Funk;8;S (50);;2375000;TECH.DXUV,TECH.ADYU,TECH.QMYL,TECH.PIVU;15.02.2002;ORG.LIEK
IS.ONHY;Bills Peak;Et aut at et sed omnis vero.;Donte Jerde;2;L (500);;246000;TECH.HSOA,TECH.TUVN,TECH.KHLR;12.11.2003;ORG.URMM
IS.CRTV;Monte Carpano;Aut sint aut doloribus necessitatibus possimus aspernatur sunt ut.;Johnie Runolfsson;5;unbekannt;;4841000;TECH.HSOA;24.06.1990;"ORG.LIEK;ORG.ECGN"
IS.YQQT;Pikes Peak;Rem quia accusantium sequi suscipit qui incidunt nobis ullam amet.;Rita Farrell;5;XS (10);;134000;TECH.TPYY,TECH.QCQR,TECH.BPYS;28.07.2010;"ORG.ECGN;ORG.QIEC"
IS.ULKM;Band-e S?frah;Suscipit ut dolores aut quam asperiores architecto optio aut ratione.;Lottie Hansen;1;XL (1000);;2973000;TECH.QCQR,TECH.BPYS;13.12.2015;"ORG.LIEK;ORG.URMM"
IS.JZGE;Gunung Entitik;Et quo praesentium natus debitis incidunt et nobis in neque.;Selena Gulgowski;2;M (100);;4274000;TECH.IBJC,TECH.BPYS,TECH.PIVU,TECH.YXCU;03.07.1990;"ORG.XTOD;ORG.LIEK"
IS.UZFP;Cerro Volantín;Non laborum unde delectus ex est vitae.;Shiela Quitzon;9;XL (1000);;1414000;TECH.IENJ,TECH.HSOA;12.12.2014;ORG.URMM
IS.MFWS;Jabal ar Ruw?;Autem totam est molestiae odio facere fuga occaecati.;Leif Price;8;unbekannt;;2690000;TECH.TPYY,TECH.UBQW,TECH.WAER,TECH.YXCU;19.07.2019;"ORG.URMM;ORG.QIEC"
IS.IIYS;Nkawini;Et labore occaecati libero dolorem quod rerum.;Leslie Towne;8;L (500);;2033000;TECH.NFNK,TECH.WAER,TECH.EFDG,TECH.MQBD,TECH.YLSE;21.12.2017;"ORG.XTOD;ORG.URMM"
IS.SXYF;K?h-e Peshk;Temporibus nobis fuga voluptatum qui error rerum fuga.;Glenn Carter;9;XL (1000);;4942000;TECH.ANEZ,TECH.IENJ,TECH.TUVN,TECH.YLSE,TECH.XQPE;01.02.1992;ORG.URMM
IS.USQF;Cerro Huachajuri;Saepe minima et deserunt aut hic laborum.;Ernesto Hirthe;7;XXL (10000);;2392000;TECH.UBQW;20.06.1991;ORG.QIEC
IS.SEKL;Bakk?r?t az Zawr;Maxime dolor assumenda esse ipsam odit voluptatibus.;Kasandra Hegmann;9;XXS (1);;1518000;TECH.QCQR,TECH.CSKO,TECH.LYON,TECH.IYIN,TECH.QMYL;24.08.2018;ORG.LIEK
IS.FQAO;Alto de Jacinto;Assumenda quaerat nihil cum tenetur sunt fuga accusantium reprehenderit.;Dr. Fred Hoeger;10;L (500);;3730000;TECH.IENJ,TECH.YLSE,TECH.XQPE;06.01.2005;ORG.LIEK
IS.JCIP;Kånehomheiæ;Sit porro ad repellat deserunt rerum qui.;Emmett Barrows;6;XL (1000);;831000;TECH.NFNK,TECH.ANEZ,TECH.BESN,TECH.PIVU,TECH.YXCU;10.12.2002;ORG.XTOD
IS.JWYL;Litluvallafjall;Error eos voluptas necessitatibus est magni quo.;Kelly Jakubowski;10;L (500);;4405000;TECH.ANEZ,TECH.IENJ,TECH.EFDG;24.12.2018;ORG.QIEC
IS.EBVX;Barthana D?dar;Qui dolor blanditiis optio eveniet iusto debitis velit ab.;Gerard Von;6;XXL (10000);;80000;TECH.IYIN;08.11.2011;ORG.ECGN
IS.HOGA;Ethuru Boli;Quo qui soluta deserunt corporis cum aut numquam veniam vero.;Harrison Reilly Jr.;9;M (100);;1713000;TECH.EFDG,TECH.QMYL,TECH.YXCU,TECH.YLSE;07.12.1994;ORG.URMM
IS.QLVX;Cimo do Atalho;Dolorem est impedit fugiat minima quasi sequi nisi corrupti.;Claude Lind;7;L (500);;1151000;TECH.ANEZ,TECH.BESN,TECH.QMYL;06.04.2009;ORG.LIEK
IS.TJZO;Little Roundtop Mountain;Ex qui non vel id quo eum iste autem.;Mose Stiedemann MD;1;XXL (10000);;3533000;TECH.CSKO,TECH.SHJB,TECH.HSOA,TECH.IYIN,TECH.JVQP;20.01.2011;"ORG.URMM;ORG.QIEC"
IS.HHAH;Ikes Butte;Dolores dolorum eos impedit distinctio eum provident reprehenderit et.;Dr. Tierra Wuckert;9;unbekannt;;3447000;TECH.YMVO;02.01.2019;ORG.QIEC
IS.ZROV;Gora Inzhenernaya;Quis laborum nam dolorem quasi et odit.;Dennis Sipes DDS;5;XXS (1);;2076000;TECH.QCQR,TECH.UBQW,TECH.HSOA,TECH.MQBD;23.08.2003;"ORG.ECGN;ORG.QIEC"
IS.DMOJ;Jabal Hadarachati;Molestiae iste at beatae quas amet quibusdam.;Florrie Walker;7;L (500);;1309000;TECH.TPYY,TECH.IENJ,TECH.EFDG;21.09.2016;"ORG.URMM;ORG.QIEC"
IS.VTWO;Cerro Campos de Tuñe;Et et in molestiae consectetur reiciendis molestiae placeat magni.;Jaime Okuneva;10;L (500);;3176000;TECH.WAER,TECH.KHLR;24.12.2018;ORG.XTOD
IS.NDOG;Jabal al Ghuway?ah;Voluptas ipsam cupiditate magnam est accusantium eius amet rerum voluptatibus.;Sibyl Rolfson;6;XXS (1);;4588000;TECH.TPYY,TECH.TUVN,TECH.MQBD;22.06.1990;ORG.QIEC
IS.CWMQ;Jebel Hamdoun;Amet deserunt nisi dolor ea nihil architecto vitae adipisci.;Romeo Labadie;9;XXL (10000);;972000;TECH.UBQW,TECH.CSKO,TECH.YMVO,TECH.HSOA,TECH.IBJC;04.09.2012;ORG.URMM
IS.SCVX;Ball Hill;Repellendus ut modi dolorem voluptatem numquam autem.;Sha Lesch;3;XXL (10000);;2199000;TECH.JOKT,TECH.SHJB,TECH.IENJ,TECH.ADYU;16.01.2017;ORG.QIEC
IS.HVCS;Khuday Ghar;Officiis sed quibusdam saepe reprehenderit adipisci cumque vitae.;Ms. France Miller;4;unbekannt;;4629000;TECH.LYON,TECH.HSOA;28.05.2002;"ORG.LIEK;ORG.QIEC"
IS.OWQG;Cerro Cochajasa;Eos non nesciunt reiciendis distinctio porro assumenda iure necessitatibus.;Mr. Laraine Schumm;3;XXL (10000);;2754000;TECH.CSKO,TECH.SHJB,TECH.YMVO;26.09.1991;ORG.LIEK
IS.CJSR;Miap’ori Storot;Sint qui sint consequatur unde culpa sint voluptatem.;Ms. Michael Will;2;XXL (10000);;1608000;TECH.QCQR,TECH.MQBD,TECH.PIVU;24.12.2010;ORG.URMM
IS.MRLU;Tabletop Mountain;Enim aliquid esse sit molestias consequatur illo quo et.;Sandra O'Reilly;2;M (100);;3323000;TECH.BESN,TECH.IBJC;08.07.2014;ORG.LIEK
IS.QYFS;K?h-e Kh?led Nab?;Quia modi ipsum rerum architecto vel vitae quia qui.;Dr. Kindra Stanton;1;S (50);;391000;TECH.BPYS;23.08.2019;ORG.LIEK
IS.QZPG;High Knob;Id voluptatem quia illum corrupti fugiat nihil voluptatem.;Lavonna Leuschke;8;M (100);;2889000;TECH.NFNK,TECH.IYIN,TECH.BPYS;23.09.1995;ORG.ECGN
IS.MBLT;Imaro;Et cum nam unde corporis provident molestiae voluptas.;Cole Rutherford;8;XL (1000);;2752000;TECH.EFDG;10.04.2004;"ORG.XTOD;ORG.ECGN"
IS.VWCK;Reschenkogel;Quia dignissimos et nihil accusantium atque ullam.;Erlene Dare;1;S (50);;1604000;TECH.BESN,TECH.EWJG,TECH.JVQP;08.11.2005;"ORG.URMM;ORG.QIEC"
IS.XGNJ;Panther Peak;Voluptas debitis dolor autem eveniet eum ut nemo.;Sheldon Hermiston;5;XXL (10000);;256000;TECH.IENJ;10.04.1996;"ORG.XTOD;ORG.QIEC"
IS.RVMF;Hit Essour;Eos nihil et dolores quod architecto repellat dolorum placeat similique.;Allen Medhurst;8;XXS (1);;4538000;TECH.ADYU;16.08.2010;"ORG.XTOD;ORG.QIEC"
IS.LGAN;Smooth Cone;Vero illo et voluptates ut quam eum id omnis eligendi.;Santos Douglas;4;XS (10);;3962000;TECH.ANEZ,TECH.WAER;01.09.1996;"ORG.XTOD;ORG.ECGN"
IS.DKII;Kokra Pah?r;Qui quas provident necessitatibus sit aut a et eum et.;Kimber Nolan;8;S (50);;3350000;TECH.NFNK,TECH.HSOA,TECH.BESN,TECH.EWJG;08.12.1992;ORG.ECGN
IS.XEZJ;Joûret el Mchâher;Sit qui quia ea dolores exercitationem nesciunt.;Mr. Guillermina Casper;7;L (500);;677000;TECH.DXUV,TECH.BESN,TECH.JVQP;06.06.1998;ORG.URMM
IS.VDVI;Mount Ollivier;In error et amet sit voluptatem in officiis consequatur.;Leanna Oberbrunner;1;L (500);;1662000;TECH.UBQW,TECH.CSKO,TECH.YMVO,TECH.ADYU,TECH.WAER;10.12.1997;ORG.XTOD
IS.QVPR;Barber Hill;Cumque est sint aliquid qui suscipit fugiat.;Ms. Ellena Bauch;4;XXL (10000);;433000;TECH.UBQW,TECH.BPYS,TECH.YLSE;04.01.2019;ORG.QIEC
IS.BMKJ;Cerro Las Canoas;Enim corporis sed dolorem architecto temporibus voluptatem.;Connie Konopelski;4;XL (1000);;4845000;TECH.UBQW,TECH.YMVO,TECH.BESN,TECH.BPYS,TECH.KHLR;25.01.1995;"ORG.LIEK;ORG.URMM"
IS.FLEG;Glebe Mountain;Quia dicta animi perferendis error iusto consequuntur eos.;Jennie Fay;6;S (50);;4386000;TECH.TPYY,TECH.DXUV,TECH.CSKO,TECH.MQBD;24.04.2001;ORG.QIEC
IS.WCHR;Pulcharati Konda;Ut quo similique voluptatibus voluptatibus et necessitatibus.;Marcus Block;6;M (100);;3770000;TECH.QCQR,TECH.LYON,TECH.QMYL,TECH.YLSE,TECH.XQPE;27.06.1993;"ORG.LIEK;ORG.URMM"
IS.QCZV;Alddas?orru;Voluptas id corporis nihil harum in quo iusto.;Stacy Reilly;10;XL (1000);;4288000;TECH.LYON,TECH.WAER,TECH.EFDG,TECH.YLSE;28.11.2007;"ORG.XTOD;ORG.LIEK"
IS.HDWL;Cerro Carhuas;Perferendis quaerat consequatur quo qui provident dignissimos ex et laborum.;Aleshia Batz;9;M (100);;610000;TECH.CSKO,TECH.WAER,TECH.ADYU;04.12.1990;ORG.QIEC
IS.ZNUZ;Salt Hill;Dolore quo molestiae ducimus laboriosam voluptate animi repudiandae ut maxime.;Mrs. Lindsey McLaughlin;3;unbekannt;;2413000;TECH.JOKT,TECH.LYON,TECH.TUVN;07.10.2008;"ORG.XTOD;ORG.QIEC"
IS.AHCA;Ball Hill;Corrupti quibusdam quia sapiente voluptatum rerum dolores.;Valentine Lindgren;6;unbekannt;;2605000;TECH.ADYU,TECH.EFDG,TECH.QMYL,TECH.JVQP;15.12.2008;"ORG.LIEK;ORG.ECGN"
IS.WITR;Little Gray Hill;Est ea asperiores sequi eum dolore ut.;Ms. Berenice Hauck;9;XXL (10000);;1020000;TECH.JOKT,TECH.SHJB,TECH.ADYU,TECH.MQBD;15.01.2006;ORG.LIEK
IS.EBSY;K?h-e B?r?sf?d;Fugiat ut ex nisi numquam libero ad occaecati aut et.;Bennie Kunze Jr.;6;S (50);;3681000;TECH.NFNK,TECH.IENJ,TECH.ADYU,TECH.XQPE;08.11.2003;"ORG.ECGN;ORG.QIEC"
IS.ZESG;Cerro Huachhualla;Adipisci hic voluptatem id explicabo debitis sequi dolores qui nisi.;Booker Carter;7;XXS (1);;4366000;TECH.QCQR,TECH.BESN,TECH.IBJC,TECH.XQPE;09.11.2015;"ORG.XTOD;ORG.URMM"
IS.YIET;K?h-e ?q D?gh;Sint error dolorem delectus dolor et facere veritatis.;Antonio Sporer;7;XS (10);;65000;TECH.QCQR,TECH.YMVO;09.04.1993;ORG.XTOD
IS.BLPK;Valichanovtoppen;Non minus corporis veniam molestiae architecto fugit.;Blanche Corwin;1;L (500);;1293000;TECH.IBJC,TECH.MQBD,TECH.EFDG;19.02.2012;ORG.QIEC
